{
  "schemaVersion": "1.0.0",
  "taskId": "102854",
  "sqlFiles": [
    {
      "slot": "query",
      "path": "sql/query.sql",
      "sha256": "8ad5a05a282afad50ccb5b08a33c557870e48e859645e45af9d7cde1ef4f3436",
      "evidenceProvider": "sql-mcp,schedule-detail"
    }
  ],
  "collectedAt": "2026-08-21T19:32:39.890Z",
  "taskCategory": "oracle2hive",
  "taskType": "20",
  "taskName": "odata_n_tit.d_trd_option_deal_settlement_f",
  "topicName": "ODATA_N_TIT",
  "source": "oracle_tit_gftzdb_gfedw",
  "target": {
    "platform": "hive",
    "qualifiedName": "odata_n_tit.d_trd_option_deal_settlement",
    "dataSource": "gfhive"
  },
  "targetEvidenceKind": "DIRECT_PLATFORM_TARGET",
  "evidenceProvider": "opencli:szdata.task-source",
  "contentHash": "8f65628721e0a13f529424eb62d69bacdeb18666eef9cac6a90ad910c01c6b10"
}

