{
  "schemaVersion": "1.0.0",
  "taskId": "78472",
  "sqlFiles": [
    {
      "slot": "query",
      "path": "sql/query.sql",
      "sha256": "a802ce5c9e3c6d37d69d820b6b23e54869abff1f4e082bbea770fb699da5f169",
      "evidenceProvider": "sql-mcp,schedule-detail"
    }
  ],
  "collectedAt": "2026-08-21T18:49:03.463Z",
  "taskCategory": "oracle2hive",
  "taskType": "20",
  "taskName": "odata_n_tit.d_ref_otc_option_deal_f",
  "topicName": "ODATA_N_TIT",
  "source": "oracle_tit_gftzdb_gfedw",
  "target": {
    "platform": "hive",
    "qualifiedName": "odata_n_tit.d_ref_otc_option_deal",
    "dataSource": "gfhive"
  },
  "targetEvidenceKind": "DIRECT_PLATFORM_TARGET",
  "evidenceProvider": "opencli:szdata.task-source",
  "contentHash": "df04c4e218b1d26d27585d42e5953601119ab5fa1b896d8e5e26dbf86b14a5bc"
}

