{
  "schemaVersion": "1.0.0",
  "taskId": "102856",
  "sqlFiles": [
    {
      "slot": "query",
      "path": "sql/query.sql",
      "sha256": "84a221f2b24e954d75d563632ea3211f1ab88acd84ade23f4cb8297d8e93342f",
      "evidenceProvider": "sql-mcp,schedule-detail"
    }
  ],
  "collectedAt": "2026-08-21T18:39:52.676Z",
  "taskCategory": "oracle2hive",
  "taskType": "20",
  "taskName": "odata_n_tit.d_ref_option_deal_strike_f",
  "topicName": "ODATA_N_TIT",
  "source": "oracle_tit_gftzdb_gfedw",
  "target": {
    "platform": "hive",
    "qualifiedName": "odata_n_tit.d_ref_option_deal_strike",
    "dataSource": "gfhive"
  },
  "targetEvidenceKind": "DIRECT_PLATFORM_TARGET",
  "evidenceProvider": "opencli:szdata.task-source",
  "contentHash": "5c04b347ab72c570a1737f4ab7d8991430c96f5aeb2dd24d4a62a58d29e12ac7"
}

