{
  "schemaVersion": "1.0.0",
  "taskId": "78576",
  "sqlFiles": [
    {
      "slot": "query",
      "path": "sql/query.sql",
      "sha256": "d782e27a56726f91220a942bc3221ddb2d5bf299f18caacd51b15641140dbde7",
      "evidenceProvider": "sql-mcp,schedule-detail"
    }
  ],
  "collectedAt": "2026-08-21T19:19:32.695Z",
  "taskCategory": "oracle2hive",
  "taskType": "20",
  "taskName": "odata_n_tit.d_trd_bundle_info_f",
  "topicName": "ODATA_N_TIT",
  "source": "oracle_tit_gftzdb_gfedw",
  "target": {
    "platform": "hive",
    "qualifiedName": "odata_n_tit.d_trd_bundle_info",
    "dataSource": "gfhive"
  },
  "targetEvidenceKind": "DIRECT_PLATFORM_TARGET",
  "evidenceProvider": "opencli:szdata.task-source",
  "contentHash": "4f49f474c21cc83551ceb8825e6c97a72a3c2423f819af4630ef7257a1354e4e"
}

