{
  "schemaVersion": "1.0.0",
  "taskId": "78569",
  "sqlFiles": [
    {
      "slot": "query",
      "path": "sql/query.sql",
      "sha256": "0414c0df92aec40972a8cb6b3f9ca15cc65ce381bbcd2351ac07564e0875e106",
      "evidenceProvider": "sql-mcp,schedule-detail"
    }
  ],
  "collectedAt": "2026-08-21T19:23:06.944Z",
  "taskCategory": "oracle2hive",
  "taskType": "20",
  "taskName": "odata_n_tit.d_trd_daily_accrual_fee_f",
  "topicName": "ODATA_N_TIT",
  "source": "oracle_tit_gftzdb_gfedw",
  "target": {
    "platform": "hive",
    "qualifiedName": "odata_n_tit.d_trd_daily_accrual_fee",
    "dataSource": "gfhive"
  },
  "targetEvidenceKind": "DIRECT_PLATFORM_TARGET",
  "evidenceProvider": "opencli:szdata.task-source",
  "contentHash": "ccbf0fa48c11a2febb1504462a07a6fd42fe7cb730514543e4ba995de7d4eac7"
}

