{
  "schemaVersion": "1.0.0",
  "taskId": "78346",
  "sqlFiles": [
    {
      "slot": "query",
      "path": "sql/query.sql",
      "sha256": "0cadef5db573ab31019f65ddf97b8f688794b3dace03a4f05538a3a506764d64",
      "evidenceProvider": "sql-mcp,schedule-detail"
    }
  ],
  "collectedAt": "2026-08-21T17:52:50.943Z",
  "taskCategory": "oracle2hive",
  "taskType": "20",
  "taskName": "odata_n_tit.d_ref_ctpty_mapping_f",
  "topicName": "ODATA_N_TIT",
  "source": "oracle_tit_gftzdb_gfedw",
  "target": {
    "platform": "hive",
    "qualifiedName": "odata_n_tit.d_ref_ctpty_mapping",
    "dataSource": "gfhive"
  },
  "targetEvidenceKind": "DIRECT_PLATFORM_TARGET",
  "evidenceProvider": "opencli:szdata.task-source",
  "contentHash": "c19b741632b9f8777477e5b984c30f7c71c48480dfa8d32fd4e5016b4a3df995"
}

