{
  "schemaVersion": "1.0.0",
  "taskId": "102846",
  "sqlFiles": [
    {
      "slot": "query",
      "path": "sql/query.sql",
      "sha256": "136249188976c4e01cac0892763ecc8bb1c87861d7e6edd10ae896dc5d7f9504",
      "evidenceProvider": "sql-mcp,schedule-detail"
    }
  ],
  "collectedAt": "2026-08-21T18:35:28.390Z",
  "taskCategory": "oracle2hive",
  "taskType": "20",
  "taskName": "odata_n_tit.d_ref_option_deal_cr_f",
  "topicName": "ODATA_N_TIT",
  "source": "oracle_tit_gftzdb_gfedw",
  "target": {
    "platform": "hive",
    "qualifiedName": "odata_n_tit.d_ref_option_deal_cr",
    "dataSource": "gfhive"
  },
  "targetEvidenceKind": "DIRECT_PLATFORM_TARGET",
  "evidenceProvider": "opencli:szdata.task-source",
  "contentHash": "ca5291c0cb8434d0e31115cd3683cdcf484f3fd272756d5c7e0c7073ed2edee7"
}

