{
  "schemaVersion": "1.0.0",
  "taskId": "78590",
  "sqlFiles": [
    {
      "slot": "query",
      "path": "sql/query.sql",
      "sha256": "ac1096319b9fbe67477ba0f98b994310546e966acb22eec74d778080febe552e",
      "evidenceProvider": "sql-mcp,schedule-detail"
    }
  ],
  "collectedAt": "2026-08-21T17:11:26.722Z",
  "taskCategory": "oracle2hive",
  "taskType": "20",
  "taskName": "odata_n_tit.d_pos_eod_calc_metrics_f",
  "topicName": "ODATA_N_TIT",
  "source": "oracle_tit_gftzdb_gfedw",
  "target": {
    "platform": "hive",
    "qualifiedName": "odata_n_tit.d_pos_eod_calc_metrics",
    "dataSource": "gfhive"
  },
  "targetEvidenceKind": "DIRECT_PLATFORM_TARGET",
  "evidenceProvider": "opencli:szdata.task-source",
  "contentHash": "abb81c025143d7862fb0ecec813890e029e87c51ac0bd21bd9dd371f800f7b60"
}

